{
  "$schema": "https://json-schema.org/draft/2020-12/schema",
  "$id": "https://schemas.redbeak.taiwaneval.com/0.1/evaluator-fixture.schema.json",
  "title": "Evaluator fixture 0.1",
  "x-redbeak-boundary": "internal",
  "description": "Evaluator-private response and outcome assertions for one case, derived deterministically from the upstream possible-answer field and stored apart from all runner-visible scenario data. It states what was expected, never how a verdict is reached: there is no pass rule, weighting, or threshold here, because those belong to the versioned evaluator rather than to the fixture. Never sent to a runner, an adapter, or a work-claim payload.",
  "type": "object",
  "additionalProperties": false,
  "required": [
    "schema_version",
    "external_id",
    "data_classification",
    "display_label",
    "user_turn_count",
    "response_assertions",
    "outcome_assertions",
    "provenance"
  ],
  "properties": {
    "schema_version": {
      "$ref": "common.schema.json#/$defs/schema_version"
    },
    "external_id": {
      "type": "string",
      "minLength": 1,
      "maxLength": 200
    },
    "data_classification": {
      "$ref": "common.schema.json#/$defs/data_classification"
    },
    "display_label": {
      "type": "string",
      "minLength": 1,
      "maxLength": 100
    },
    "user_turn_count": {
      "description": "How many of the reference turns correspond to a user turn in the normalized scenario. Upstream Base carries at least one record whose reference answer ends with a verification turn the user never asked for, so the two counts are not always equal. Recording the boundary keeps that trailing turn available to the evaluator instead of silently truncating it, and stops a later reader from assuming response_assertions[i] always pairs with turns[i].",
      "type": "integer",
      "minimum": 1,
      "maximum": 64
    },
    "response_assertions": {
      "description": "One entry per user turn, in turn order, holding the calls the upstream reference answer makes on that turn after parsing. Parsing is structural only: the strings are turned into function names and argument values so the evaluator does not have to re-parse them, and no comparison semantics are implied.",
      "type": "array",
      "minItems": 1,
      "maxItems": 64,
      "items": {
        "$ref": "#/$defs/turn_assertion"
      }
    },
    "outcome_assertions": {
      "description": "The observable end-state facts the evaluator may request after the final turn. Fact names only: the contract never carries an expected value, and the evaluator alone decides whether an observed fact satisfies the reference answer.",
      "type": "object",
      "additionalProperties": false,
      "required": ["fact_names"],
      "properties": {
        "fact_names": {
          "description": "May be empty when the case has no observable end state and the verdict rests on the response alone, as for a single-turn multiple-choice question.",
          "type": "array",
          "minItems": 0,
          "maxItems": 64,
          "uniqueItems": true,
          "items": {
            "$ref": "common.schema.json#/$defs/fact_name"
          }
        }
      }
    },
    "provenance": {
      "type": "object",
      "additionalProperties": false,
      "required": [
        "source_record_id",
        "source_revision",
        "raw_questions_sha256",
        "raw_possible_answers_sha256"
      ],
      "properties": {
        "source_record_id": {
          "type": "string",
          "minLength": 1,
          "maxLength": 200
        },
        "source_revision": {
          "type": "string",
          "minLength": 7,
          "maxLength": 64,
          "pattern": "^[0-9a-f]{7,40}$"
        },
        "raw_questions_sha256": {
          "$ref": "common.schema.json#/$defs/sha256"
        },
        "raw_possible_answers_sha256": {
          "$ref": "common.schema.json#/$defs/sha256"
        }
      }
    }
  },
  "$defs": {
    "turn_assertion": {
      "type": "object",
      "additionalProperties": false,
      "required": ["sequence", "expected_calls"],
      "properties": {
        "sequence": {
          "$ref": "common.schema.json#/$defs/sequence"
        },
        "expected_calls": {
          "type": "array",
          "minItems": 0,
          "maxItems": 64,
          "items": {
            "$ref": "#/$defs/expected_call"
          }
        }
      }
    },
    "expected_call": {
      "description": "One parsed reference call. `arguments` is typed as leak_free_object so that even here, where the material is legitimately evaluator-private, a nested rubric or threshold cannot be smuggled in under an argument name and later copied outward with the rest of the record.",
      "type": "object",
      "additionalProperties": false,
      "required": ["function", "arguments"],
      "properties": {
        "function": {
          "type": "string",
          "minLength": 1,
          "maxLength": 200
        },
        "arguments": {
          "$ref": "common.schema.json#/$defs/leak_free_object"
        },
        "positional_arguments": {
          "description": "Values the upstream string passed positionally. Kept ordered and separate from named arguments because binding them to parameter names would require a tool signature the importer deliberately does not have.",
          "type": "array",
          "minItems": 1,
          "maxItems": 32,
          "items": {
            "$ref": "common.schema.json#/$defs/leak_free_value"
          }
        }
      }
    }
  }
}
