{
  "data_classification": "synthetic",
  "display_label": "Synthetic / BFCL-derived",
  "external_id": "synthetic_file_ops_2",
  "outcome_assertions": {
    "fact_names": ["gorilla_file_system_state"]
  },
  "provenance": {
    "raw_possible_answers_sha256": "sha256:b7c2b7c2b7c2b7c2b7c2b7c2b7c2b7c2b7c2b7c2b7c2b7c2b7c2b7c2b7c2b7c2",
    "raw_questions_sha256": "sha256:a3f1a3f1a3f1a3f1a3f1a3f1a3f1a3f1a3f1a3f1a3f1a3f1a3f1a3f1a3f1a3f1",
    "source_record_id": "synthetic_file_ops_2",
    "source_revision": "0123456789abcdef0123456789abcdef01234567"
  },
  "response_assertions": [
    {
      "expected_calls": [
        {
          "arguments": {
            "name": "sample",
            "path": "."
          },
          "function": "find"
        }
      ],
      "sequence": 0
    },
    {
      "expected_calls": [
        {
          "arguments": {
            "folder": "workspace_one"
          },
          "function": "cd"
        },
        {
          "arguments": {
            "folder": "workspace_two"
          },
          "function": "cd"
        },
        {
          "arguments": {
            "destination": "holding_area",
            "source": "sample_alpha.txt"
          },
          "function": "cp"
        },
        {
          "arguments": {
            "destination": "holding_area",
            "source": "sample_beta.txt"
          },
          "function": "cp"
        }
      ],
      "sequence": 1
    }
  ],
  "schema_version": "0.1",
  "user_turn_count": 2
}
